{
  "schemaVersion": "1.0.0",
  "id": "night-crossing-guoman-cast",
  "title": "夜渡 · 国漫版",
  "fictionNotice": "原创架空国风短片，角色与世界均为虚构，不复现任何现有动画角色。",
  "aspectRatio": "16:9",
  "resolution": "720p",
  "fps": 24,
  "style": "风格化写实三维国漫，鲜明原创CG人物造型，电影级暖灯冷月光，写实衣甲材质，人物、服装、场景布局与光向全片一致。",
  "referenceImages": [
    "references/cast.jpg"
  ],
  "segments": [
    {
      "id": "camp",
      "durationSeconds": 30,
      "scene": "interior-camp",
      "referenceSegments": [],
      "prompt": "制作一段30秒、九个镜头的原创架空国风三维动画短片。人物采用风格化写实的高规格3D国漫造型，脸部有明确的动画模型设计感，衣甲是精细PBR材质，电影照明，细腻表演；不是真人拍摄，不临摹任何现有影视动画角色。\n人物身份与服装只参考 @图片1。左侧年轻将军：无胡须，棱角清晰的英挺脸，修长杏眼，黑发高髻与一缕鬓发，黑铁细片甲、暗红披风、深褐内袍。右侧年长斥候：较宽的脸，浓眉、短须，褐色布带束发，灰褐粗麻袍、皮肩甲、米灰围巾。保留这两个原创人物的模型脸型、眼型、服装纹样与色块，镜头中不换脸、不变年龄、不换发型、不变披风颜色。\n军帐空间固定：年轻将军在画左，年长斥候在画右，低木桌横在两人之间，旧布地图固定在桌上，唯一一盏小铜油灯在桌前左角，后方左侧帐柱，后方中偏右帐门。保持场景几何、布料、灯位和暖冷光关系；人物特写必须重新取景，不把特写拉宽成远景。@图片1 的双栏、纯色背景、定妆姿势不得出现在电影里。任何时刻都是完整单幅画面，无分屏。\n场景：夜间架空国风边塞军帐内部，粗布帐壁，木桌与旧布地图，画左一盏低油灯暖光，后方帐门冷月光。地理关系固定：将军在画左朝画右，斥候在画右朝画左；摄影机始终在两人对话轴线南侧，近景正反打不能越轴。高级三维国漫角色表演，脸部为细腻但明显的CG雕塑形体，克制的情绪动画，清楚的眼神变化，衣料和甲片有写实质感，暖金与冷蓝灰色层次丰富；不要变成真人照片或平面插画。光线保证眼睛可读，暗部有层次，不全黑。镜头切换按下面的时间顺序，均为有叙事目的的硬切，不使用旋转、快速变焦或炫技环绕。\n镜头1 [0:00–0:03]：35mm双人中景轻微横移，将军在左、斥候在右面对桌上地图，油灯在画左，完成位置交代。\n镜头2 [0:03–0:08]：切斥候65mm胸口以上近景，面朝画左，脸在画面右三分之一，双眼清楚，背景军帐柔化。急促的呼吸收住后，他开口报告，口型同步下方第一句声音事件。\n镜头3 [0:08–0:11]：切85mm右手与布地图细节，斥候粗糙右食指缓慢落在地图河道上，接着保持压住；桌面和手的方向连续。第二句对白作为画外音继续，手不会移动到另一张地图。\n镜头4 [0:11–0:16]：切将军85mm面部近景，不要退成中景，头顶至锁骨充满画面。眼神先看画下方地图，短暂停顿后抬到画右斥候，镜头仅缓慢推近一点点，第三句对白从容低声说完，不喊口号。\n镜头5 [0:16–0:20]：切斥候近景反应，他先稍怔，咽下一口气，眼神变坚定，点头一次；说第四句，短促有力但不大喊。\n镜头6 [0:20–0:23]：切将军眼睛至鼻梁的极近特写，固定机位，眼中有真实油灯光点，呼吸轻微，注视不游移。把决心放在眼神里，保持三秒细腻的角色表演，不生成静态照片推拉。\n镜头7 [0:23–0:26]：侧后方50mm中景，将军果断转向帐门迈出一步，暗红披风跟随惯性摆动，斥候从右侧跟上。动作自然，人物不瞬移。\n镜头8 [0:26–0:28]：将军的暗红披风掠过镜头形成短暂遮挡，在遮挡处硬切到稍后河岸；低机位50mm马蹄特写，两匹马从画左向画右走过湿碎石。马蹄声提前0.5秒在前一镜末尾响起，形成自然的声音先入转场，不叠化、不闪白。\n镜头9 [0:28–0:30]：35mm背侧中远景平稳轻拉，同一位暗红披风将军与同一位灰褐袍斥候沿寒冷河岸往画右远处走去，将军暗红披风仍可辨认，斥候跟在后方；真实夜色、低芦苇与浅雾，正常马步，只两匹马。以行动背影收束全片，不加台词，不要航拍。\n声音：原生同步中文对白。将军是低沉清楚的青年男声，克制而有力量；斥候是略沙哑的中年男声，疲惫但不含糊。第一句在3.5–7.8秒，{斥候用中文说：“将军，河对岸还有三十人。”} 第二句在8.3–10.8秒，{斥候用中文说：“冰撑不到天亮。”} 第三句在11.8–15.8秒，{将军用中文说：“天亮之前，把他们带回来。”} 第四句在18–19秒，{斥候用中文说：“诺。”}\n0–25.5秒环境声为<帐外低风、灯芯轻微噼啪、衣甲布料轻响>；25.5–30秒逐渐接入<两匹马的马蹄声、皮革轻响和河岸风声>，说话时环境声很低，不掩盖尾字。非画内音乐为空，不生成配乐。对白直接从指定中文首字开始，不生成外语前导、额外旁白、人声或重复对白。全程无字幕、无对白文字叠加、无片名、无标志、无水印；地图只要模糊线条，不要可读汉字。",
      "shots": [
        {
          "id": "s01",
          "start": 0,
          "end": 3,
          "size": "MEDIUM",
          "camera": "35mm，低幅侧移，建立桌子两侧位置",
          "visual": "油灯照着粗布军帐，年轻将军在画左、斥候在画右，桌上只有摊开的旧布地图。",
          "purpose": "先建立空间与主次，斥候不抢戏。"
        },
        {
          "id": "s02",
          "start": 3,
          "end": 8,
          "size": "CLOSE_UP",
          "camera": "65mm，斥候胸口以上近景，机位在轴线同一侧",
          "visual": "斥候压低声音，急促呼吸逐渐平稳；目光朝画左的将军。",
          "purpose": "把救人的困难交给一张具体的脸。"
        },
        {
          "id": "s03",
          "start": 8,
          "end": 11,
          "size": "INSERT",
          "camera": "85mm，手与地图特写，固定机位",
          "visual": "斥候粗糙右食指落在地图弯曲的河道，将军的手停在桌沿，不做双人交接。",
          "purpose": "用手指落点连接危险与选择，减少道具形变风险。"
        },
        {
          "id": "s04",
          "start": 11,
          "end": 16,
          "size": "CLOSE_UP",
          "camera": "85mm，将军面部近景，极缓慢推近",
          "visual": "将军先看地图，再抬眼看向画右，眉心微收，随后决定。",
          "purpose": "由思考转为决断，以眼神变化推动镜头。"
        },
        {
          "id": "s05",
          "start": 16,
          "end": 20,
          "size": "CLOSE_UP",
          "camera": "65mm，斥候反应近景，固定机位",
          "visual": "斥候短暂怔住，嘴唇微张，随即收紧下颌，点头一次。",
          "purpose": "给观众看到命令对另一个人的影响。"
        },
        {
          "id": "s06",
          "start": 20,
          "end": 23,
          "size": "EXTREME_CLOSE_UP",
          "camera": "85mm，将军眼睛与鼻梁特写，浅景深，固定",
          "visual": "将军目光不再游移，灯芯爆出一点火星，脸上只有自然微表情。",
          "purpose": "让沉默承担决心，不追加台词解释。"
        },
        {
          "id": "s07",
          "start": 23,
          "end": 26,
          "size": "MEDIUM",
          "camera": "50mm，侧后方中景，跟随一步",
          "visual": "将军转身迈向帐门，斥候紧随，深红披风自然摆动。",
          "purpose": "从决策转到行动，动作接剪。"
        },
        {
          "id": "s08",
          "start": 26,
          "end": 28,
          "size": "INSERT",
          "camera": "50mm，低机位固定",
          "visual": "两匹马的马蹄从画左向画右前进，湿碎石被踩响。",
          "purpose": "先声后画接外景。"
        },
        {
          "id": "s09",
          "start": 28,
          "end": 30,
          "size": "WIDE",
          "camera": "35mm，缓慢后拉",
          "visual": "两骑沿河岸往画右远处走去。",
          "purpose": "把人物放回危险的环境，留下余韵。"
        }
      ],
      "dialogue": [
        {
          "start": 3.5,
          "end": 7.8,
          "speaker": "斥候",
          "text": "将军，河对岸还有三十人。"
        },
        {
          "start": 8.3,
          "end": 10.8,
          "speaker": "斥候",
          "text": "冰撑不到天亮。"
        },
        {
          "start": 11.8,
          "end": 15.8,
          "speaker": "将军",
          "text": "天亮之前，把他们带回来。"
        },
        {
          "start": 18,
          "end": 19,
          "speaker": "斥候",
          "text": "诺。"
        }
      ]
    }
  ],
  "edit": {
    "audioLeadSeconds": 0.0,
    "targetLufs": -16,
    "title": "夜渡",
    "endCard": "天亮之前。",
    "subtitlePolicy": "对白逐字来自剧本，实际时码在生成后校准。"
  },
  "limits": {
    "maxInitialRequests": 1,
    "maxOutputSeconds": 30,
    "automaticRegeneration": false
  },
  "skillSources": {
    "repository": "https://github.com/zenstory-ai/drama-skills",
    "ref": "v0.8.1",
    "skills": [
      "short-drama-storyboard",
      "short-drama-video-prompts",
      "short-drama-edit",
      "short-drama-review"
    ]
  }
}
